{
  "name": "m37-progress-measure",
  "domain": "progress-measure",
  "schemaVersion": 1,
  "schema": "m37-progress-measure.schema.json",
  "cases": [
    {
      "name": "record-profile-rep-max",
      "function": "progress_series",
      "note": "repMax takes each Workout's highest e1RM point; 100 kg x 6 beats 100 kg x 5.",
      "input": {
        "exerciseId": "e-squat",
        "profile": {"dimensions": ["load", "reps"], "loadMode": "added", "recordProfile": "repMax"},
        "workouts": [
          {"workoutId": "w1", "localDate": "2026-09-07", "startedAt": "2026-09-07T07:00:00.000Z", "sets": [
            {"id": "s1", "position": 0, "isCompleted": true, "values": {"load": {"entered": "100", "unit": "kilogram"}, "reps": {"entered": "5", "unit": "repetition"}}},
            {"id": "s2", "position": 1, "isCompleted": true, "values": {"load": {"entered": "105", "unit": "kilogram"}, "reps": {"entered": "3", "unit": "repetition"}}}
          ]},
          {"workoutId": "w2", "localDate": "2026-09-14", "startedAt": "2026-09-14T07:00:00.000Z", "sets": [
            {"id": "s3", "position": 0, "isCompleted": true, "values": {"load": {"entered": "110", "unit": "kilogram"}, "reps": {"entered": "1", "unit": "repetition"}}},
            {"id": "s4", "position": 1, "isCompleted": true, "values": {"load": {"entered": "100", "unit": "kilogram"}, "reps": {"entered": "6", "unit": "repetition"}}}
          ]},
          {"workoutId": "w3", "localDate": "2026-09-21", "startedAt": "2026-09-21T07:00:00.000Z", "sets": [
            {"id": "s5", "position": 0, "isCompleted": true, "values": {"load": {"entered": "100", "unit": "kilogram"}, "reps": {"entered": "5", "unit": "repetition"}}}
          ]}
        ]
      },
      "expected": {
        "exerciseId": "e-squat", "measure": "estimatedOneRepMax", "betterIs": "higher",
        "points": [
          {"workoutId": "w1", "localDate": "2026-09-07", "startedAt": "2026-09-07T07:00:00.000Z", "setId": "s1", "value": 112.5, "unit": "kilogram", "isNewBest": false},
          {"workoutId": "w2", "localDate": "2026-09-14", "startedAt": "2026-09-14T07:00:00.000Z", "setId": "s4", "value": 116.12903225806451, "unit": "kilogram", "isNewBest": true},
          {"workoutId": "w3", "localDate": "2026-09-21", "startedAt": "2026-09-21T07:00:00.000Z", "setId": "s5", "value": 112.5, "unit": "kilogram", "isNewBest": false}
        ]
      }
    },
    {
      "name": "record-profile-max-load",
      "function": "progress_series",
      "note": "maxLoad takes the headline record: the heaviest Performed Set.",
      "input": {
        "exerciseId": "e-press",
        "profile": {"dimensions": ["load", "reps"], "loadMode": "added", "recordProfile": "maxLoad"},
        "workouts": [
          {"workoutId": "w1", "localDate": "2026-09-07", "startedAt": "2026-09-07T07:00:00.000Z", "sets": [
            {"id": "s1", "position": 0, "isCompleted": true, "values": {"load": {"entered": "80", "unit": "kilogram"}, "reps": {"entered": "8", "unit": "repetition"}}}
          ]},
          {"workoutId": "w2", "localDate": "2026-09-14", "startedAt": "2026-09-14T07:00:00.000Z", "sets": [
            {"id": "s2", "position": 0, "isCompleted": true, "values": {"load": {"entered": "85", "unit": "kilogram"}, "reps": {"entered": "3", "unit": "repetition"}}},
            {"id": "s3", "position": 1, "isCompleted": true, "values": {"load": {"entered": "70", "unit": "kilogram"}, "reps": {"entered": "10", "unit": "repetition"}}}
          ]}
        ]
      },
      "expected": {
        "exerciseId": "e-press", "measure": "maxLoad", "betterIs": "higher",
        "points": [
          {"workoutId": "w1", "localDate": "2026-09-07", "startedAt": "2026-09-07T07:00:00.000Z", "setId": "s1", "value": 80, "unit": "kilogram", "isNewBest": false},
          {"workoutId": "w2", "localDate": "2026-09-14", "startedAt": "2026-09-14T07:00:00.000Z", "setId": "s2", "value": 85, "unit": "kilogram", "isNewBest": true}
        ]
      }
    },
    {
      "name": "record-profile-max-reps",
      "function": "progress_series",
      "note": "maxReps: a worse Workout is a point but not a New Best.",
      "input": {
        "exerciseId": "e-pullup",
        "profile": {"dimensions": ["reps"], "loadMode": "added", "recordProfile": "maxReps"},
        "workouts": [
          {"workoutId": "w1", "localDate": "2026-09-07", "startedAt": "2026-09-07T07:00:00.000Z", "sets": [
            {"id": "s1", "position": 0, "isCompleted": true, "values": {"reps": {"entered": "10", "unit": "repetition"}}}
          ]},
          {"workoutId": "w2", "localDate": "2026-09-14", "startedAt": "2026-09-14T07:00:00.000Z", "sets": [
            {"id": "s2", "position": 0, "isCompleted": true, "values": {"reps": {"entered": "8", "unit": "repetition"}}}
          ]},
          {"workoutId": "w3", "localDate": "2026-09-21", "startedAt": "2026-09-21T07:00:00.000Z", "sets": [
            {"id": "s3", "position": 0, "isCompleted": true, "values": {"reps": {"entered": "12", "unit": "repetition"}}}
          ]}
        ]
      },
      "expected": {
        "exerciseId": "e-pullup", "measure": "maxReps", "betterIs": "higher",
        "points": [
          {"workoutId": "w1", "localDate": "2026-09-07", "startedAt": "2026-09-07T07:00:00.000Z", "setId": "s1", "value": 10, "unit": "repetition", "isNewBest": false},
          {"workoutId": "w2", "localDate": "2026-09-14", "startedAt": "2026-09-14T07:00:00.000Z", "setId": "s2", "value": 8, "unit": "repetition", "isNewBest": false},
          {"workoutId": "w3", "localDate": "2026-09-21", "startedAt": "2026-09-21T07:00:00.000Z", "setId": "s3", "value": 12, "unit": "repetition", "isNewBest": true}
        ]
      }
    },
    {
      "name": "record-profile-max-duration",
      "function": "progress_series",
      "note": "maxDuration: the longest hold.",
      "input": {
        "exerciseId": "e-plank",
        "profile": {"dimensions": ["duration"], "loadMode": "added", "recordProfile": "maxDuration"},
        "workouts": [
          {"workoutId": "w1", "localDate": "2026-09-07", "startedAt": "2026-09-07T07:00:00.000Z", "sets": [
            {"id": "s1", "position": 0, "isCompleted": true, "values": {"duration": {"entered": "60", "unit": "second"}}}
          ]},
          {"workoutId": "w2", "localDate": "2026-09-14", "startedAt": "2026-09-14T07:00:00.000Z", "sets": [
            {"id": "s2", "position": 0, "isCompleted": true, "values": {"duration": {"entered": "90", "unit": "second"}}},
            {"id": "s3", "position": 1, "isCompleted": true, "values": {"duration": {"entered": "45", "unit": "second"}}}
          ]}
        ]
      },
      "expected": {
        "exerciseId": "e-plank", "measure": "maxDuration", "betterIs": "higher",
        "points": [
          {"workoutId": "w1", "localDate": "2026-09-07", "startedAt": "2026-09-07T07:00:00.000Z", "setId": "s1", "value": 60, "unit": "second", "isNewBest": false},
          {"workoutId": "w2", "localDate": "2026-09-14", "startedAt": "2026-09-14T07:00:00.000Z", "setId": "s2", "value": 90, "unit": "second", "isNewBest": true}
        ]
      }
    },
    {
      "name": "record-profile-max-distance",
      "function": "progress_series",
      "note": "maxDistance in kilometres, miles converted.",
      "input": {
        "exerciseId": "e-ride",
        "profile": {"dimensions": ["distance"], "loadMode": "added", "recordProfile": "maxDistance"},
        "workouts": [
          {"workoutId": "w1", "localDate": "2026-09-07", "startedAt": "2026-09-07T07:00:00.000Z", "sets": [
            {"id": "s1", "position": 0, "isCompleted": true, "values": {"distance": {"entered": "20", "unit": "kilometer"}}}
          ]},
          {"workoutId": "w2", "localDate": "2026-09-14", "startedAt": "2026-09-14T07:00:00.000Z", "sets": [
            {"id": "s2", "position": 0, "isCompleted": true, "values": {"distance": {"entered": "18.5", "unit": "kilometer"}}}
          ]},
          {"workoutId": "w3", "localDate": "2026-09-21", "startedAt": "2026-09-21T07:00:00.000Z", "sets": [
            {"id": "s3", "position": 0, "isCompleted": true, "values": {"distance": {"entered": "15", "unit": "mile"}}}
          ]}
        ]
      },
      "expected": {
        "exerciseId": "e-ride", "measure": "maxDistance", "betterIs": "higher",
        "points": [
          {"workoutId": "w1", "localDate": "2026-09-07", "startedAt": "2026-09-07T07:00:00.000Z", "setId": "s1", "value": 20, "unit": "kilometer", "isNewBest": false},
          {"workoutId": "w2", "localDate": "2026-09-14", "startedAt": "2026-09-14T07:00:00.000Z", "setId": "s2", "value": 18.5, "unit": "kilometer", "isNewBest": false},
          {"workoutId": "w3", "localDate": "2026-09-21", "startedAt": "2026-09-21T07:00:00.000Z", "setId": "s3", "value": 24.14016, "unit": "kilometer", "isNewBest": true}
        ]
      }
    },
    {
      "name": "record-profile-min-duration",
      "function": "progress_series",
      "note": "minDuration is better when lower.",
      "input": {
        "exerciseId": "e-row-2k",
        "profile": {"dimensions": ["distance", "duration"], "loadMode": "added", "recordProfile": "minDuration"},
        "workouts": [
          {"workoutId": "w1", "localDate": "2026-09-07", "startedAt": "2026-09-07T07:00:00.000Z", "sets": [
            {"id": "s1", "position": 0, "isCompleted": true, "values": {"distance": {"entered": "2", "unit": "kilometer"}, "duration": {"entered": "480", "unit": "second"}}}
          ]},
          {"workoutId": "w2", "localDate": "2026-09-14", "startedAt": "2026-09-14T07:00:00.000Z", "sets": [
            {"id": "s2", "position": 0, "isCompleted": true, "values": {"distance": {"entered": "2", "unit": "kilometer"}, "duration": {"entered": "470", "unit": "second"}}}
          ]}
        ]
      },
      "expected": {
        "exerciseId": "e-row-2k", "measure": "minDuration", "betterIs": "lower",
        "points": [